{
  "contract": "atlas-onboarding-record/1",
  "projectId": "4f7d1c2a-8b3e-4c5d-9e6f-a1b2c3d4e5f6",
  "name": "Contract intake for EMEA HR Services",
  "stage": "value",
  "revision": 12,
  "gates": [
    {
      "stage": "intake",
      "decision": "pass",
      "at": "2026-10-01T08:00:00.000Z"
    },
    {
      "stage": "reuse",
      "decision": "pass",
      "at": "2026-10-06T09:30:00.000Z"
    },
    {
      "stage": "capture",
      "decision": "pass",
      "at": "2026-10-28T10:00:00.000Z"
    }
  ],
  "evidenceAccepted": 2,
  "evidencePending": 0,
  "osProjectId": "proj-1234",
  "teoaScopeId": "scope-hr-emea-intake",
  "visionObjectiveId": "fy27-hr-cycle-time",
  "reuseDecision": "new",
  "buildDecision": null,
  "entryType": "process",
  "valueBasis": "measured",
  "updatedAt": "2026-10-28T10:30:00.000Z"
}
